{"stamps":{"contract_version":"1.0.0","registry_version":"b9762e99fa2b5f9696b8f21793b9421002a3039de27c28f7373d8857f64f4e26","measurement_source":"statsbomb","source":"statsbomb","season_ids":[27],"season_parquet_sha256":"572ee7948d2fc89a7ff7bea3e6db0abd6308b767f06cf6f9ba58bf79dc82b7f0","percentiles_parquet_sha256":"71dd579ffe7916a7a3ea401a42965d8c2ebb22c0dee12ddd2df27a79deed6003","dna_parquet_sha256":"476bf4fabf14907a2d8fc50f41da63d6371565a072ab2fb2f70c37c9044d5664","positions_parquet_sha256":"a19975bb2bfef9d984eeace3b7c2485690d99c38f1d18a8c3355accd91e1b68e","match_parquet_sha256":"6c97bb09c00046246f956abbe41064655920b0cb272ee7bbc5e2c8ef9b08ac9b","pass_mix_parquet_sha256":"6187aee2b4b59463b96b19b2fc134a142ca9fed98b73fbff103bee9264ad709f"},"group":"ST","group_text":"strikers","caption":"Position shows style, not quality","axes":[{"name_positive":"Aerial target","name_negative":"Technical forward","title":"Technical forward ↔ Aerial target","note":"\"Aerial target\" mostly measures how often the striker contests aerial duels (aerials won +0.30, lost +0.28), with aerial win rate weaker (+0.20). It is not headed shots or headed goals.","variance_share":0.279168,"variance_text":"28%","positive_end":["Aerials won","Aerials lost","Aerial win rate"],"negative_end":["Shots (non-penalty)","Long passes","Box entries (pass)"]},{"name_positive":"Box striker","name_negative":"Safe passer","title":"Safe passer ↔ Box striker","note":null,"variance_share":0.181238,"variance_text":"18%","positive_end":["Shots (non-penalty)","Aerial win rate","Aerials won"],"negative_end":["Pass completion"]}],"variance_text":"46%","points":[{"key":"3010-133-7-27","display_name":"Corentin Jean","team":"Troyes","league":"Ligue 1 2015/16","minutes_text":"2646","x":-0.132483,"y":-0.194337,"role":"mixed","role_text":"Mixed: Left winger or left midfielder / Striker (LW / ST)","lean":["Leans toward Technical forward (slight)","Leans toward Safe passer (strong)"],"pushes":[[{"metric":"np_shots_p90","label":"Shots (non-penalty)","adjective":"Low","phrase":"bottom 28%","toward":"Aerial target","push":0.038034},{"metric":"pass_completion_pct","label":"Pass completion","adjective":"Very high","phrase":"top 5%","toward":"Technical forward","push":-0.033893},{"metric":"aerials_won_p90","label":"Aerials won","adjective":"Low","phrase":"bottom 13%","toward":"Technical forward","push":-0.026909}],[{"metric":"np_shots_p90","label":"Shots (non-penalty)","adjective":"Low","phrase":"bottom 28%","toward":"Safe passer","push":-0.054704},{"metric":"pass_completion_pct","label":"Pass completion","adjective":"Very high","phrase":"top 5%","toward":"Safe passer","push":-0.048804},{"metric":"aerial_win_pct","label":"Aerial win rate","adjective":"Very low","phrase":"bottom 10%","toward":"Safe passer","push":-0.037053}]]},{"key":"3018-134-7-27","display_name":"Giovanni Sio","team":"Rennes","league":"Ligue 1 2015/16","minutes_text":"2719","x":0.072947,"y":-0.051956,"role":"ST","role_text":"Striker (ST)","lean":["Near the middle of Technical forward ↔ Aerial target","Near the middle of Safe passer ↔ Box striker"],"pushes":[[{"metric":"box_entries_pass_p90","label":"Box entries (pass)","adjective":"Very low","phrase":"bottom 10%","toward":"Aerial target","push":0.028},{"metric":"progressive_passes_p90","label":"Progressive passes","adjective":"Very low","phrase":"bottom 10%","toward":"Aerial target","push":0.025357},{"metric":"progressive_carries_p90","label":"Progressive carries","adjective":"Low","phrase":"bottom 33%","toward":"Aerial target","push":0.010159}],[{"metric":"progressive_passes_p90","label":"Progressive passes","adjective":"Very low","phrase":"bottom 10%","toward":"Safe passer","push":-0.017671},{"metric":"final_third_entries_pass_p90","label":"Final-third entries (pass)","adjective":"Low","phrase":"bottom 28%","toward":"Safe passer","push":-0.014476},{"metric":"pass_completion_pct","label":"Pass completion","adjective":"High","phrase":"top 39%","toward":"Safe passer","push":-0.011966}]]},{"key":"3038-140-7-27","display_name":"Andy Delort","team":"Stade Malherbe Caen","league":"Ligue 1 2015/16","minutes_text":"3285","x":-0.134051,"y":0.242551,"role":"ST","role_text":"Striker (ST)","lean":["Leans toward Technical forward (slight)","Leans toward Box striker (strong)"],"pushes":[[{"metric":"np_shots_p90","label":"Shots (non-penalty)","adjective":"Very high","phrase":"top 8%","toward":"Technical forward","push":-0.068728},{"metric":"pass_completion_pct","label":"Pass completion","adjective":"Very low","phrase":"bottom 5%","toward":"Aerial target","push":0.034328},{"metric":"long_passes_attempted_p90","label":"Long passes","adjective":"High","phrase":"top 16%","toward":"Technical forward","push":-0.030922}],[{"metric":"np_shots_p90","label":"Shots (non-penalty)","adjective":"Very high","phrase":"top 8%","toward":"Box striker","push":0.098851},{"metric":"pass_completion_pct","label":"Pass completion","adjective":"Very low","phrase":"bottom 5%","toward":"Box striker","push":0.04943},{"metric":"aerial_win_pct","label":"Aerial win rate","adjective":"High","phrase":"top 19%","toward":"Box striker","push":0.029443}]]},{"key":"3114-144-7-27","display_name":"Emiliano Sala","team":"Nantes","league":"Ligue 1 2015/16","minutes_text":"2067","x":0.030718,"y":0.097158,"role":"ST","role_text":"Striker (ST)","lean":["Near the middle of Technical forward ↔ Aerial target","Leans toward Box striker (slight)"],"pushes":[[{"metric":"np_shots_p90","label":"Shots (non-penalty)","adjective":"High","phrase":"top 33%","toward":"Technical forward","push":-0.026951},{"metric":"pass_completion_pct","label":"Pass completion","adjective":"Low","phrase":"bottom 19%","toward":"Aerial target","push":0.023668},{"metric":"aerials_lost_p90","label":"Aerials lost","adjective":"High","phrase":"top 22%","toward":"Aerial target","push":0.018622}],[{"metric":"np_shots_p90","label":"Shots (non-penalty)","adjective":"High","phrase":"top 33%","toward":"Box striker","push":0.038764},{"metric":"pass_completion_pct","label":"Pass completion","adjective":"Low","phrase":"bottom 19%","toward":"Box striker","push":0.034081},{"metric":"progressive_passes_p90","label":"Progressive passes","adjective":"High","phrase":"top 25%","toward":"Box striker","push":0.011659}]]},{"key":"3179-135-7-27","display_name":"Nolan Roux","team":"Saint-Étienne","league":"Ligue 1 2015/16","minutes_text":"2062","x":-0.02104,"y":0.104312,"role":"mixed","role_text":"Mixed: Right winger or right midfielder / Striker (RW / ST)","lean":["Near the middle of Technical forward ↔ Aerial target","Leans toward Box striker (slight)"],"pushes":[[{"metric":"long_passes_attempted_p90","label":"Long passes","adjective":"Very high","phrase":"top 10%","toward":"Technical forward","push":-0.036026},{"metric":"aerials_lost_p90","label":"Aerials lost","adjective":"Very low","phrase":"bottom 8%","toward":"Technical forward","push":-0.028852},{"metric":"pass_completion_pct","label":"Pass completion","adjective":"Low","phrase":"bottom 13%","toward":"Aerial target","push":0.027932}],[{"metric":"pass_completion_pct","label":"Pass completion","adjective":"Low","phrase":"bottom 13%","toward":"Box striker","push":0.040221},{"metric":"long_passes_attempted_p90","label":"Long passes","adjective":"Very high","phrase":"top 10%","toward":"Box striker","push":0.030189},{"metric":"np_shots_p90","label":"Shots (non-penalty)","adjective":"High","phrase":"top 39%","toward":"Box striker","push":0.025412}]]},{"key":"3184-146-7-27","display_name":"Enzo Crivelli","team":"Bordeaux","league":"Ligue 1 2015/16","minutes_text":"1630","x":0.194617,"y":-0.073429,"role":"ST","role_text":"Striker (ST)","lean":["Leans toward Aerial target (slight)","Leans toward Safe passer (slight)"],"pushes":[[{"metric":"np_shots_p90","label":"Shots (non-penalty)","adjective":"Very low","phrase":"bottom 5%","toward":"Aerial target","push":0.075169},{"metric":"aerials_lost_p90","label":"Aerials lost","adjective":"Very high","phrase":"top 5%","toward":"Aerial target","push":0.030016},{"metric":"progressive_carries_p90","label":"Progressive carries","adjective":"Very low","phrase":"bottom 8%","toward":"Aerial target","push":0.025424}],[{"metric":"np_shots_p90","label":"Shots (non-penalty)","adjective":"Very low","phrase":"bottom 5%","toward":"Safe passer","push":-0.108115},{"metric":"long_passes_attempted_p90","label":"Long passes","adjective":"Low","phrase":"bottom 22%","toward":"Safe passer","push":-0.021134},{"metric":"aerials_won_p90","label":"Aerials won","adjective":"High","phrase":"top 25%","toward":"Box striker","push":0.019792}]]},{"key":"3210-136-7-27","display_name":"Valère Germain","team":"OGC Nice","league":"Ligue 1 2015/16","minutes_text":"3224","x":0.018975,"y":-0.06498,"role":"ST","role_text":"Striker (ST)","lean":["Near the middle of Technical forward ↔ Aerial target","Leans toward Safe passer (slight)"],"pushes":[[{"metric":"np_shots_p90","label":"Shots (non-penalty)","adjective":"Low","phrase":"bottom 19%","toward":"Aerial target","push":0.051959},{"metric":"long_passes_attempted_p90","label":"Long passes","adjective":"High","phrase":"top 22%","toward":"Technical forward","push":-0.025818},{"metric":"pass_completion_pct","label":"Pass completion","adjective":"High","phrase":"top 30%","toward":"Technical forward","push":-0.014706}],[{"metric":"np_shots_p90","label":"Shots (non-penalty)","adjective":"Low","phrase":"bottom 19%","toward":"Safe passer","push":-0.074733},{"metric":"long_passes_attempted_p90","label":"Long passes","adjective":"High","phrase":"top 22%","toward":"Box striker","push":0.021635},{"metric":"pass_completion_pct","label":"Pass completion","adjective":"High","phrase":"top 30%","toward":"Safe passer","push":-0.021176}]]},{"key":"3213-142-7-27","display_name":"Jimmy Briand","team":"Guingamp","league":"Ligue 1 2015/16","minutes_text":"3103","x":-0.09334,"y":-0.020494,"role":"ST","role_text":"Striker (ST)","lean":["Leans toward Technical forward (slight)","Near the middle of Safe